{
  "site_id": "example.com",
  "site_stage": "harvest",
  "service_value_weights": {
    "emergency roof repair": 1.6,
    "roof replacement": 1.4,
    "roof repair cost": 0.8
  },
  "target_customer_priority": {
    "primary": ["local homeowners ready to book or request a quote"],
    "deprioritized": ["national informational readers outside service area"]
  },
  "location_priorities": {
    "Portland": { "priority": "high", "notes": "High-margin service area with capacity." }
  },
  "conversion_events": [
    {
      "name": "quote_request",
      "weight": 1.5,
      "paths": ["/contact", "/quote", "/roof-repair"],
      "intent_terms": ["near me", "quote", "emergency"]
    },
    {
      "name": "phone_call",
      "weight": 1.3,
      "intent_terms": ["call", "open now", "emergency"]
    }
  ],
  "booking_intent_hierarchy": {
    "highest_priority": ["emergency roof repair portland", "roof repair near me"],
    "supporting_only": ["how much does roof repair cost", "roof repair cost"]
  },
  "local_proof_points": ["same-day inspection", "licensed local team", "transparent price ranges"],
  "serp_competitor_positioning": {
    "roof repair near me": ["map pack", "Angi", "Yelp", "local contractors"]
  },
  "page_role_map": {
    "/roof-repair": "transactional local landing page",
    "/roof-repair-prices": "local commercial-research page",
    "/blog/roof-repair-cost": "supporting informational page"
  },
  "internal_link_sources": {
    "/roof-repair-prices": {
      "hub_pages": ["/services"],
      "adjacent_commercial_pages": ["/roof-repair"],
      "support_pages": ["/blog/roof-repair-cost"]
    }
  },
  "retired_or_cannibal_pages": [
    {
      "url": "/old-roof-repair-pricing",
      "desired_state": "redirected and absent from sitemap/internal links",
      "canonical_owner": "/roof-repair-prices"
    }
  ]
}
